docno,text,score
meta-llama_Llama-2-13b-chat-hf_109_multimedqa_6,"Ehlers Danlos Syndrom... Certainly! I'd be happy to help you understand the potential connection between Ehlers-Danlos syndrome (EDS), postural orthostatic tachycardia syndrome (POTS), nausea, and stomach pain. Ehlers-Danlos Syndrome (EDS) is a group of genetic disorders that affect the body's connective tissue, which provides support and structure to various organs and systems throughout the body. One of the most common symptoms of EDS is joint hypermobility, but individuals with EDS may also experience other signs such as skin hyperextensibility, bruising easily, and poor wound healing. Postural Orthostatic Tachycardia Syndrome (POTS) is a type of autonomic nervous system disorder that is often associated with EDS. POTS occurs when the body has difficulty regulating heart rate and blood pressure during changes in posture, leading to rapid heartbeat, dizziness, lightheadedness, and fainting spells upon standing. Symptoms can range from mild to severe and are typically triggered by sudden changes in position or exercise. Nausea and abdominal pain are two additional symptoms that people with EDS and/or POTS may experience. These gastrointestinal issues could result from several factors related to EDS and/or POTS, including: Gastric motility disturbances: EDS and POTS might impair the normal functioning of the digestive system, causing food to move too quickly or slowly through the stomach and small intestine. This could lead to nausea, bloating, cramping, diarrhea, or constipation. Hormonal imbalances: The autonomic nervous system plays a crucial role in regulating hormone secretion and metabolism. Disruptions in autonomic function caused by EDS and/or POTS might affect hormones like cortisol, insulin, and ghrelin, contributing to symptoms like nausea, fatigue, and weight changes. Maldigestion and malabsorption: Some individuals with EDS and/or POTS have trouble breaking down certain nutrients due to",-0.0062821060419082
chatgpt_109_multimedqa_1,"Ehlers-Danlos Syndrome (EDS) is a group of genetic disorders that affect the connective tissues in the body. One common symptom of EDS is Postural Orthostatic Tachycardia Syndrome (POTS), which is a condition characterized by an abnormal increase in heart rate upon standing up. Nausea and stomach pain can be associated with EDS and POTS, although they are not specific to these conditions and can have various other causes. It is important to consult with a healthcare professional for an accurate diagnosis and appropriate management of your symptoms. Stomach pain and nausea can be caused by gastrointestinal dysmotility, which is commonly seen in individuals with EDS and POTS. Dysmotility refers to abnormal movement of the digestive tract, leading to symptoms such as bloating, abdominal pain, and nausea. Other potential causes of stomach pain and nausea in individuals with EDS and POTS include: 1. Gastroparesis: It is a condition where the stomach muscles do not function properly, leading to delayed emptying of the stomach contents. This can cause symptoms like early satiety, bloating, and nausea. 2. Small Intestinal Bacterial Overgrowth (SIBO): EDS and POTS patients may have an increased risk of SIBO, which occurs when there is an overgrowth of bacteria in the small intestine. This can result in symptoms like abdominal pain, bloating, and nausea. 3. Gastroesophageal Reflux Disease (GERD): EDS and POTS can also contribute to the development of GERD, a condition where stomach acid flows back into the esophagus, causing heartburn, regurgitation, and nausea. Managing stomach pain and nausea in individuals with EDS and POTS may involve a multidisciplinary approach, including lifestyle modifications, dietary changes, medications, and physical therapy. It is crucial to work with healthcare professionals who are knowledgeable about these conditions to develop an individualized treatment plan.",-0.006354839541018
meta-llama_Llama-2-7b-chat-hf_109_multimedqa_2,"Ehlers-Danlos syndrome (EDS) is a group of genetic disorders that affect the body's connective tissue, which provides support to various organs and structures throughout the body, including the heart, blood vessels, joints, skin, and digestive system. Some individuals with EDS may experience symptoms related to autonomic dysfunction, such as postural orthostatic tachycardia syndrome (POTS), nausea, and stomach pain. Here's what you need to know: Postural Orthostatic Tachycardia Syndrome (POTS): Postural orthostatic tachycardia syndrome (POTS) is a condition in which an individual experiences a rapid heart rate upon standing or changing positions, often accompanied by symptoms like lightheadedness, fainting, fatigue, brain fog, and shortness of breath. POTS can occur due to autonomic nervous system dysfunction, which is commonly seen in individuals with Ehlers-Danlos syndrome (EDS). The exact mechanisms underlying POTS in EDS are not fully understood; however, several theories suggest that it could be related to problems within the autonomic nervous system, including abnormalities in neuronal functioning, neurotransmitter imbalances, and impaired baroreceptor functioning. Nausea and Stomach Pain: Individuals with Ehlers-Danlos syndrome (EDS) may also experience gastrointestinal symptoms, including nausea and stomach pain, which can vary in severity and frequency depending on the specific type of EDS they have. These gastrointestinal issues might result from difficulties in the body's ability to process nutrients, poor gut motility, or increased sensitivity to certain foods. In some cases, gastroparesis (delayed emptying of food from the stomach into the small intestine) has been observed in people with EDS. In conclusion, if you suspect you or someone you know may have Ehlers-Danlos syndrome (EDS) and are experiencing symptoms such as POTS, nausea, and stomach pain, consult your doctor for proper evaluation and diagnosis. While there is currently no cure for EDS, early detection",-0.006924086716026
tiiuae_falcon-7b-instruct_109_multimedqa_6,"Ehlers Danlos Syndrome (EDS) is a genetic disorder that affects connective tissues in the body. POTS, or Postural Orthostatic Tachycardia Syndrome, is a condition that causes symptoms such as lightheadedness and rapid heartbeat upon standing. Nausea and stomach pain can also be part of the EDS POTS symptoms. Some tips for managing symptoms include staying hydrated, pacing activities, using compression stockings, and working with a physical therapist or occupational therapist. It is important to consult with a healthcare professional for a proper diagnosis and treatment plan.",-0.0075191580690443
gpt2-xl_109_multimedqa_7,"The Ehlers-Danlos syndrome (EDS) is an autoimmune disease of the connective tissue that results in muscle weakness, joint stiffness, tenderness and fatigue throughout one's body. This debilitating condition results from a genetic defect on the gene encoding collagen type I, which makes up 90% of all connective tissues, as well as another gene that produces collagen type III, or elastin.\r POTS means postural orthostatic tachycardia syndrome, which is a form of autonomic nervous system dysfunction that can cause dizziness, syncope, fainting spells and shortness of breath. \r Symptoms include fatigue, loss of energy, confusion, palpitations and heart palpitations. There may be other symptoms such as headaches, nausea, vomiting, diarrhea, weight gain and constipation.\r People with this disorder often feel lightheaded and have difficulty walking for long periods of time due to the effects of low blood pressure. They also experience back pain that becomes worse with standing. Other symptoms associated with this disorder include muscle spasms, numbness, tingling, prickly sensations, skin rashes, hair loss and darkening of the nails.\r Nausea and vomiting are both symptoms that occur frequently during POTS episodes. Gastrointestinal distress may also contribute to some cases of POTS because it causes gastrointestinal discomfort. \r If you suspect you may have POTS, you should discuss your symptoms with your physician who will likely order additional tests to determine if the diagnosis is correct. If the test shows that you do indeed have POTS, you may need medication treatments as well. However, if the symptoms resolve on their own without treatment, then the disease may simply be a symptom of underlying diseases such as asthma, diabetes and cardiovascular conditions. In some instances, the underlying causes may not yet be known. \r More information: http://www.ehleros.com/newsletter_pressrelease.asp?cid=1187\u0026bfrlsef&catid=6",-0.0272014401853084
49015b2b-6ce7-4403-8b83-285b37c4f33c,"Pain and gastrointestinal dysfunction are significant associations with psychiatric disorders in patients with Ehlers–Danlos syndrome and hypermobility spectrum disorders: a retrospective study , , , , , & , –() In this retrospective study, we investigate the frequency and types of psychiatric disorders and their relationship to systemic manifestations in a cohort of 391 Ehlers–Danlos syndromes (EDS) and hypermobility spectrum disorder (HSD) patients based on the current 2017 International Classification of EDS diagnostic criteria. A detailed, systematic retrospective chart review was undertaken for patients assessed for HSD or EDS at two Canadian health centres. Patients were diagnosed according to the Villefranche criteria and reclassified for this study according to the 2017 International Classification of EDS. Data validation and statistical analyses were conducted. Psychiatric disorders were very common, with 49.4% of the total cohort affected; 28.9% reported multiple psychiatric diagnoses. Mood (34.5%) and somatoform (28.6%) disorders were most common. Interestingly, attention-deficit/hyperactivity disorder (ADHD) was significantly enriched in the HSD, but not EDS cohort ( = 0.0002, 95% CI 3.48–9.00) compared to the general population. There were no differences in the systemic associations with having psychiatric manifestations in the HSD compared to the EDS subsets. Muscle/body pain (OR 1.99) and gastrointestinal dysfunction (OR 2.07) were significantly associated with having mood disorders, and gastrointestinal dysfunction (OR 2.61) and nerve-related pain (OR 3.27) were associated with having somatoform disorders across the cohort. The common systemic associations with the presence of psychiatric manifestations in both HSD and EDS reaffirm that the conditions should be treated as a spectrum rather than as wholly separate entities, particularly with respect to psychiatric management. EDS and HSD patients share common psychiatric presentations, though ADHD is more common with HSD. This is a preview of subscription content, to check access. Tax calculation will be finalised during checkout. Immediate online access to all issues from 2019. Subscription will auto renew annually. Tax calculation will be finalised during checkout. Hakim AJ, Sahota A (2006) Joint hypermobility and skin elasticity: the hereditary disorders of connective tissue. Clin Dermatol 24:521–533. https://doi.org/10.1016/j.clindermatol.2006.07.013 Beighton P, De Paepe A, Steinmann B et al (1998) Ehlers–Danlos syndromes: revised nosology, Villefranche, 1997. Ehlers–Danlos National Foundation (USA) and Ehlers–Danlos Support Group (UK). Am J Med Genet 77:31–37 Malfait F, Francomano C, Byers P et al (2017) The 2017 international classification of the Ehlers–Danlos syndromes. Am J Med Genet C Semin Med Genet 175:8–26. Castori M, Tinkle B, Levy H et al (2017) A framework for the classification of joint hypermobility and related conditions. Am J Med Genet C Semin Med Genet 175:148–157. Syx D, De Wandele I, Rombaut L, Malfait F (2017) Hypermobility, the Ehlers–Danlos syndromes and chronic pain. Clin Exp Rheumatol 107:116–122 Colombi M, Dordoni C, Chiarelli N, Ritelli M (2015) Differential diagnosis and diagnostic flow chart of joint hypermobility syndrome/Ehlers–Danlos syndrome hypermobility type compared to other heritable connective tissue disorders. Am J Med Genet C Semin Med Genet 169C:6–22. Rodgers KR, Gui J, Dinulos MBP, Chou RC (2017) Ehlers–Danlos syndrome hypermobility type is associated with rheumatic diseases. Sci Rep. Davis NA (2005) Invisible disability. Ethics 116:153–213 Murray B, Yashar BM,",-3.717028379440308
gpt2-large_109_multimedqa_9,"(This answer does not include the symptoms of encephalitis or Guillain-Barré Syndrome). If you were unable to find an answer that was correct for your question, please contact our Customer Care Center at 800-838-2277 or email us at support@heartsandscholar.com\r \r Health care professionals have been told by their patients that if they do not see any improvement after several weeks, it is probably a sign that something is wrong. This is because symptoms can develop rapidly in some people who go through very severe illness. For example, someone with multiple sclerosis will start seeing a wide range of changes within 3-6 months of diagnosis, but may not show signs of serious illness until a year later.\r In general, it takes only a few days for many people to become severely ill. Some people experience symptoms that last a week or more. In fact, some people actually have much longer illness than this.\r A person may suddenly begin showing all kinds of bizarre behavior, including eating strange foods, falling down stairs, getting lost on the street, jumping from moving cars, experiencing extreme panic attacks, and so on. The doctor should be alert to these behaviors, as well as the obvious physical problems such as vomiting, loss of appetite, fatigue, and dizziness. Symptoms of Ehlers Danlos syndrome can come on suddenly, often without warning, and then disappear after a time. They usually appear gradually over the course of weeks to months, and can range from mild discomfort, such as occasional stomach aches, diarrhea, abdominal cramping, or headaches, to severe fatigue, blurred vision, numbness/tingling in one side of the body, difficulty breathing, seizures, coma, and death.\r People with Ehlers Danlos syndrome cannot normally swallow food whole. It's just too painful. So what happens when patients lose control of their bowels? One explanation is that fluids accumulate inside their bodies. When you drink, urine collects around the edges of your stomach. When you vomit, large amounts of liquid fall out onto the floor. This fluid contains many minerals (such as calcium, potassium and magnesium) which can cause kidney stones. \r It isn't known exactly how water gets into the intestines during vomiting; the fluid accumulates in the small intestine. However, there has been speculation that dehydration causes the accumulation of water in the gastrointestinal tract. There are two types of damage caused by",-3.831997394561768
4931924b-00a4-4af9-852f-85ea685f770a,"Vaccine updates, safe care and visitor guidelines, and trusted coronavirus information ​ , , , , . . Mayo Clinic Graduate School of Biomedical Sciences Mayo Clinic School of Continuous Professional Development Postural orthostatic tachycardia syndrome and chronic fatigue in adolescents: Working toward recovery Chronic fatigue is common and often multifactorial in adolescents. In some patients, fatigue is due to a concurrent medical condition, inadequate sleep habits or coexisting psychological challenges. Occasionally, however, the fatigue persists in the absence of identifiable medical conditions. Many teens who experience chronic fatigue have additional symptoms, including tachycardia, dizziness, headaches, nausea and abdominal pain, that suggest the presence of some form of autonomic dysfunction. Postural orthostatic tachycardia syndrome (POTS) is one type of autonomic dysfunction. Specific definitions vary, but generally include chronic fatigue and two key components: Excessive postural tachycardia (more than 40 beats a minute) with supine to upright positioning on a tilt table In addition to these signs and symptoms, adolescents with POTS often also experience depression and anxiety. According to , a pediatric physiatrist at Mayo Clinic Children's Center in Minnesota, the social and economic consequences related to POTS are significant. ""Adolescent patients diagnosed with POTS may experience decreased school attendance, withdrawal from extracurricular activities, decreased academic performance and truancy,"" notes Dr. Driscoll. ""And, as patients have multiple consultations while seeking a diagnosis and treatment, this condition can also have a significant financial impact on families."" While research continues to explore the pathophysiology of this condition, it's important to note that effective treatment is available for these patients. Dr. Driscoll advises that once the medical evaluation is complete, providers should encourage patients and their families to move beyond the search for medical diagnoses and focus on recovery. ""Education and motivating patients to incorporate new healthy-living practices into their lives can help remediate POTS symptoms and reduce the negative impact of POTS and chronic fatigue in adolescents,"" says Dr. Driscoll. In a recent article published in Current Problems in Pediatric and Adolescent Health Care, Dr. Driscoll and colleagues provide an overview about POTS and chronic fatigue, reviewing the relevant medical and psychological literature, and drawing upon the authors' practice experiences. Below are a few highlights from this review article, focusing on recovery strategies. As they struggle to find help for a condition that is not yet well-understood, many patients with POTS and their parents experience feelings of isolation and lack of social support. Education focusing on self-management and fostering social support is helpful. Individual and group education sessions that involve both patients and their families can encourage social interaction and lessen the feelings of isolation. Sessions should encourage a systematic approach to comprehensive lifestyle changes required for managing this condition. Patients with POTS can experience a wide range of symptoms that no single medication or treatment can relieve. Treatment plans at Mayo Clinic typically use multidisciplinary care teams that may include specialists in general pediatrics, neurology, physical medicine and rehabilitation, sleep medicine, pulmonology, cardiology, infectious disease, psychology, psychiatry, and others as needed. Improvement in sleep hygiene, aerobic exercise and strength training, and cognitive behavioral",-4.940775871276856
d6616bae-4cf8-40ad-93e6-5d6d179d9e18,"One sign of Ehlers-Danlos Syndrome is having joints that can extend past the normal range of motion. See more The human body is made up of many kinds of tissue that serve important daily functions. Tissues hold the body together, protect the body's insides, enable movement and carry electrical messages from the brain to the rest of the body. Everything the body does depends on its tissues. So what happens when connective tissues, including bones and inner layers of skin, don't work the way they should? Ehlers-Danlos Syndrome, or EDS, is an inherited genetic disorder that affects the body's connective tissues and prevents the body from functioning in the way that it should. Symptoms of EDS include: Joints that move beyond the normal range of motion, which can lead to dislocations and chronic pain Extremely delicate skin that is susceptible to injury Overly stretchy skin, which makes the skin vulnerable to damage and exposes a person's internal organs to harm EDS abnormalities such as these are caused by faulty collagen, which is the substance that gives strength and elasticity to connective tissues in the skin, joints and blood vessel walls [source: ]. The six main types of Ehlers-Danlos Syndrome each have their own specific symptoms. The severity of these symptoms varies on a case-by-case basis, sometimes affecting the patient in such a minor way that EDS goes undiagnosed, and sometimes causing severe mobility issues. Ehlers-Danlos Syndrome is rare, and patients diagnosed with EDS should remain under a doctor's care in order to address their specific symptoms. If you or someone you know has been diagnosed with Ehlers-Danlos Syndrome, you might be wondering what the symptoms of EDS are and how it is treated. You also might be worried about passing it on to your children. Keep reading to find out what you need to know. Although all forms of Ehlers-Danlos Syndrome share certain symptoms, such as muscle fatigue and stretchy skin, the six distinct types of EDS each present specific symptoms. Three of these types are extremely rare. The most common forms of EDS are hypermobility, classical EDS and vascular EDS. , which affects 1 in 10,000 to 15,000 people, causes looseness in both large and small joints. Dislocations are common, and patients often experience pain in their joints and limbs [source: ]. affects 1 in 20,000 to 40,000 people, and it's marked by skin hyperextensibility (stretchiness), scars and wounds that don't heal properly, fatty and noncancerous growths, and delicate skin tissue that is vulnerable to bruising [source: ]. has been reported in an estimated 1 in 250,000 people. This type is considered highly serious because of the risk of major organs or blood vessels rupturing. People with vascular EDS have very thin and fragile skin, which is often so translucent that veins can be seen through it [source: ]. Easy bruising is common. High risk factors associated with vascular EDS often result in a life expectancy of about 50 years [source: ]. The other three forms of EDS are rare, having been reported in fewer than 100 cases worldwide. , which",-5.805263042449951
af289a02-7165-45ae-974e-7779c3f0aa20,"One sign of Ehlers-Danlos Syndrome is having joints that can extend past the normal range of motion. See more The human body is made up of many kinds of tissue that serve important daily functions. Tissues hold the body together, protect the body's insides, enable movement and carry electrical messages from the brain to the rest of the body. Everything the body does depends on its tissues. So what happens when connective tissues, including bones and inner layers of skin, don't work the way they should? Ehlers-Danlos Syndrome, or EDS, is an inherited genetic disorder that affects the body's connective tissues and prevents the body from functioning in the way that it should. Symptoms of EDS include: Joints that move beyond the normal range of motion, which can lead to dislocations and chronic pain Extremely delicate skin that is susceptible to injury Overly stretchy skin, which makes the skin vulnerable to damage and exposes a person's internal organs to harm EDS abnormalities such as these are caused by faulty collagen, which is the substance that gives strength and elasticity to connective tissues in the skin, joints and blood vessel walls [source: ]. The six main types of Ehlers-Danlos Syndrome each have their own specific symptoms. The severity of these symptoms varies on a case-by-case basis, sometimes affecting the patient in such a minor way that EDS goes undiagnosed, and sometimes causing severe mobility issues. Ehlers-Danlos Syndrome is rare, and patients diagnosed with EDS should remain under a doctor's care in order to address their specific symptoms. If you or someone you know has been diagnosed with Ehlers-Danlos Syndrome, you might be wondering what the symptoms of EDS are and how it is treated. You also might be worried about passing it on to your children. Keep reading to find out what you need to know. Although all forms of Ehlers-Danlos Syndrome share certain symptoms, such as muscle fatigue and stretchy skin, the six distinct types of EDS each present specific symptoms. Three of these types are extremely rare. The most common forms of EDS are hypermobility, classical EDS and vascular EDS. , which affects 1 in 10,000 to 15,000 people, causes looseness in both large and small joints. Dislocations are common, and patients often experience pain in their joints and limbs [source: ]. affects 1 in 20,000 to 40,000 people, and it's marked by skin hyperextensibility (stretchiness), scars and wounds that don't heal properly, fatty and noncancerous growths, and delicate skin tissue that is vulnerable to bruising [source: ]. has been reported in an estimated 1 in 250,000 people. This type is considered highly serious because of the risk of major organs or blood vessels rupturing. People with vascular EDS have very thin and fragile skin, which is often so translucent that veins can be seen through it [source: ]. Easy bruising is common. High risk factors associated with vascular EDS often result in a life expectancy of about 50 years [source: ]. The other three forms of EDS are rare, having been reported in fewer than 100 cases worldwide. , which",-5.805263042449951
