docno,text,score
meta-llama_Llama-2-13b-chat-hf_57_multimedqa_3,"Multiple Sclerosis (MS) is a chronic autoimmune disease that affects the central nervous system (CNS). The progression of MS can be divided into several stages or phases, which help clinicians monitor the severity of the disease and adjust treatment plans accordingly. Here are the main stages of MS: 1. Relapsing-remitting stage: This is the initial phase of MS, characterized by episodes of acute relapses followed by periods of remission. During these relapses, new symptoms may appear, and existing ones may worsen. The relapsing-remitting stage accounts for 85% of all MS cases. 2. Secondary progressive stage: As the name suggests, this stage follows the relapsing-remitting stage, typically after several years. In this stage, patients experience steady worsening of neurological symptoms without any clear relapses. The secondary progressive stage comprises approximately 60% of all MS cases. 3. Primary progressive stage: This rare form of MS (about 10% of cases) is characterized by gradual worsening of symptoms from the onset, with no distinct relapses. Patients with primary progressive MS tend to have more severe disability earlier in the course of the disease. 4. Progressive-relapsing stage: This stage combines elements of both the secondary progressive and relapsing-remitting stages. It features a steadily worsening condition punctuated by occasional relapses. Only around 5% of MS cases fit into this category. 5. Spinal cord disease: Some individuals with MS experience involvement of the spinal cord, leading to symptoms such as weakness, numbness, or paralysis below the level of the lesion. Spinal cord disease can occur at any stage of MS but is more common in the later stages. 6. Clinically isolated syndrome (CIS): CIS refers to a single episode of demyelinating symptoms that lasts at least 24 hours and is not accompanied by MRI evidence of MS. Although CIS does not necessarily develop into MS, it carries a high risk (around 70%) of converting to either relapsing-remitting or primary progressive MS within five years. It's important to note that these stages are",-0.0075635253451764
tiiuae_falcon-7b-instruct_57_multimedqa_3,"Multiple sclerosis is a complex disease with a variety of stages and phases, but here are some general information.\nPhase 1: Early-onset MS symptoms, typically relapsing-remitting type.\nPhase 2: Relapsing-remitting type of MS, where symptoms come and go. This is the most common form of MS.\nPhase 3: Secondary progressive MS, where the disease progresses and becomes more severe. This stage typically leads to significant disability.\nPhase 4: Tertiary progressive MS, where there may be neurological disability, cognitive impairment, and difficulty walking. This stage is very severe and may result in significant life expectancy reduction.\nPhase 5: Progressive-relapsing MS, where symptoms continue to worsen and there may be significant neurological disability. This stage can also lead to significant life expectancy reduction.\nPhase 6: Double-hit MS, where a person has two autoimmune diseases, one of which is MS. In this case, the autoimmune disease that occurs prior to or during MS may worsen the progression of MS.",-0.0078448299318552
meta-llama_Llama-2-7b-chat-hf_57_multimedqa_4,"Multiple sclerosis (MS) is a chronic autoimmune disease that affects the central nervous system (CNS). The progression of MS can be divided into several distinct stages or phases, which vary in duration and symptoms. In this answer, we will outline these stages in detail and provide information on how they impact individuals with MS."" The 5 Stages Of Multiple Sclerosis 1. Relapsing Remitting MS - This stage accounts for approximately 85% of all cases and involves periods of acute relapses followed by partial remission. During relapses, new symptoms emerge or existing ones worsen before improving over time. Symptoms may include fatigue, vision problems, coordination issues, and cognitive difficulties. 2. Secondary Progressive MS - As the name suggests, this phase follows the initial Relapsing Remitting stage and is characterized by steady worsening of symptoms without any noticeable periods of remission. Over time, mobility and balance become increasingly impaired due to muscle weakness and spasticity, leading to difficulty walking independently or performing daily tasks without assistance from others. Balance problems also increase significantly during secondary progressive MS making it essential for patients to take extra precautions while moving around their surroundings; especially when alone at home or outside. Common challenges faced during secondaries progression involve managing bladder dysfunction caused by nerve damage as well as maintaining mental clarity due too brain fog experienced often accompany such physical limitations. Although there isn't currently no cure available yet, medications such as DMTs(disease modifying therapies), steroids along side physiotherapy exercises & occupational/speech therapies help manage specific aspects related directly or indirectly towards enhancing overall quality life despite these disabilities associated closely linked closely together herein described below furthermore mentioned elsewhere later part answer provided carefully composed manner suitable readership preferences found relevant online resources recommended whenever possible pertaining particular subject matter discussed right now next portion response given accordingly please proceed reading find more details regarding subtopics listed just prior including other helpful suggestions related general topic under discussion herein now following content..."".",-0.0085151214152574
chatgpt_57_multimedqa_10,"Multiple sclerosis (MS) is a chronic autoimmune disease that affects the central nervous system. It is characterized by inflammation and damage to the protective covering of nerve fibers, known as myelin, which disrupts the normal flow of electrical impulses. The progression of MS can vary greatly from person to person, and it is divided into different stages or phases based on the pattern and severity of symptoms. There are four commonly recognized stages of multiple sclerosis: 1. Relapsing-Remitting MS (RRMS): This is the most common form of MS, affecting approximately 85% of people diagnosed. In this phase, individuals experience unpredictable relapses or attacks, during which new symptoms appear or existing ones worsen. These relapses are followed by periods of partial or complete recovery, known as remissions, where symptoms may improve or disappear. The disease does not progress during remission. 2. Secondary-Progressive MS (SPMS): After a variable period of time (often years) with relapsing-remitting MS, some individuals transition to secondary-progressive MS. In this stage, there is a gradual worsening of symptoms and disability, with or without occasional relapses and remissions. The disease may continue to progress steadily, leading to increased disability over time. 3. Primary-Progressive MS (PPMS): Approximately 10-15% of people with MS are initially diagnosed with primary-progressive MS. In this form, there is a steady worsening of symptoms and disability without distinct relapses or remissions. The progression may vary, with some periods of stability or temporary improvement. 4. Progressive-Relapsing MS (PRMS): This is the least common form of MS, affecting about 5% of people diagnosed. It is characterized by a steady worsening of symptoms from the beginning, along with occasional relapses and remissions. Disability accumulates over time, with or without recovery between relapses. It is important to note that the progression of MS is highly individualized, and not all individuals will experience the same stages or follow a linear pattern. Some people may remain in the relapsing-remitting stage throughout their lives, while others may progress to a more advanced stage. Treatment options for MS aim to slow disease progression, manage symptoms, and improve quality of life. These may include disease-modifying therapies, medications for symptom management, physical therapy, and lifestyle modifications. Consulting with a healthcare professional specializing in MS is crucial for accurate diagnosis, monitoring, and personalized treatment recommendations.",-0.0110331233590841
gpt2-xl_57_multimedqa_5,"\nThe first stage is when the body is unable to produce enough of an enzyme called IL1 beta by itself. During this phase, there are symptoms such as weakness, numbness and tingling in arms and legs. This occurs because your immune system is not able to recognize the signal from your own body's cells that tell it to make antibodies against foreign proteins in your tissues. When you come down with multiple sclerosis, the disease becomes chronic. The second stage is inflammation, which means the immune system has begun to attack its own tissue. Symptoms include fatigue, loss of muscle strength, difficulty walking or sitting up. You may also experience vision problems as well as other types of brain damage including memory loss, confusion, difficulty concentrating, dizziness and fainting, depression, anxiety and sleeplessness. In the third stage, inflammation has spread to your bones. Your joints become inflamed so badly that they break easily. Your feet may swell and become painful and painful urination can be difficult. Eventually, your muscles will start to weaken. In the final stage, the body's ability to respond to a normal infection causes permanent damage to the lining of the bowel. Once multiple sclerosis hits your 50s, you're likely to live a long time, but you'll still have problems with getting around, walking and breathing.\r \r ""The more information your doctor knows about how your body works, the better equipped he or she will be to help you."" ~Dr. Michael Fiske, Harvard Medical School \r \r ""A good question to ask an expert is, 'How many people are living with MS at any one time?'"" \r \r Learn More About Multiple Sclerosis | Learn How To Reduce Your Risk Of Developing Multiple Sclerosis",-0.0473583564162254
gpt2_57_multimedqa_2,MS stage 1 is the last phase of disease that starts in your body before you have fully recovered from it or after recovery; Stage 2 (stage 3) occurs when symptoms begin within 10 days following treatment but may not occur for more than 20 days thereafter. Diagnosis can be made by using an automated diagnostic test with follow up interviews such as one performed on yourself at home during normal periods while healthy conditions resolve themselves - see Table 6 below The above information will help patients make informed decisions based upon their needs rather then being forced into what they believe might work best under certain circumstances,-0.0507228448987007
gpt2-medium_57_multimedqa_2,"1 of 3 - (1) Multiple Sclerosis Stage; 2 Phase(s); or more information that you know helps guide the way forward in your patients journey towards recovery from MS.? \r ​ Question : I'm wondering if there is any medication i need right now for my symptoms? I have been trying different medications with no success? Do they work??I would like something quick so I can go get it on line/phone asap :) Thank You! \u2013 Dr Maryanne Ostrom, MD NIMH Clinical Research Associate / Assistant Professor at New York University School Of Medicine | @MaryanneOstrander",-0.0664535090327262
acd5f7da-ddcd-4703-96a5-a457ba56d385,"Multiple sclerosis is a neurodegenerative disorder that damages the nerves in the brain and spinal cord, leading to problems with muscle movement, balance and vision. The illness is an example of a demyelinating disease, where the protective coating called myelin that surrounds nerve fibres becomes damaged. Integrin b3 and ACE2 linked by short linear motifs enabling endocytosis and autophagy of SARS-CoV-2 Study finds higher suicide rate among people with neurological disorders Drug prices beat inflation all the way even with discounts Multiple sclerosis follows a different course in every individual but there are three main ways in which the disease can progress depending on which form of the illness a patient has. Around 80% of all individuals with multiple sclerosis have the relapsing remitting form of the disease. These individuals have periods where their symptoms are mild or absent (remission), followed by periods of symptom relapse. Symptoms may occur suddenly and in acute bouts or exacerbations. During these periods of relapse, symptoms may become worse each time and the relapsing remitting form of this condition may eventually progress to secondary progressive multiple sclerosis, where there are few or no periods of remission. Relapsing remitting multiple sclerosis may be diagnosed when two episodes of relapse are separated by more than 30 days or there has only been one relapse but there is MRI evidence of newly scarred or damaged myelin three months later. Patients with this form of multiple sclerosis often experience phases of relapse followed by remission at first, but this later gives way to progressive disease, characterized by worsening symptoms and few or no periods of remission. The least common form of multiple sclerosis is the primary progressive form which occurs in about 10% to 15% of all cases and usually in people aged over 40 years. In this form of the condition, symptoms get worse over time rather than occurring in bouts or as sudden attacks. Primary progressive multiple sclerosis may be diagnosed if there have been no previous symptoms of relapse but the patient has become increasingly disabled over a period of at least one year. http://www.nhs.uk/Conditions/Multiple-sclerosis/Pages/Causes.aspx www.nlm.nih.gov/medlineplus/tutorials/multiplesclerosis/nr229105.pdf http://www.who.int/mental_health/neurology/Atlas_MS_WEB.pdf http://www.nice.org.uk/nicemedia/live/10930/29202/29202.pdf Last Updated: Aug 23, 2018 Dr. Ananya Mandal is a doctor by profession, lecturer by vocation and a medical writer by passion. She specialized in Clinical Pharmacology after her bachelor's (MBBS). For her, health communication is not just writing complicated reviews for professionals but making medical knowledge understandable and available to the general public as well. Please use one of the following formats to cite this article in your essay, paper or report: Mandal, Ananya. (2018, August 23). How is RRMS Different from PPMS and SPMS?. News-Medical. Retrieved on January 21, 2021 from https://www.news-medical.net/health/How-is-RRMS-Different-from-PPMS-and-SPMS.aspx. Mandal, Ananya. ""How is RRMS Different from PPMS and SPMS?"". . 21 January 2021. <https://www.news-medical.net/health/How-is-RRMS-Different-from-PPMS-and-SPMS.aspx>. Mandal, Ananya. ""How is RRMS Different from PPMS and SPMS?"". News-Medical. https://www.news-medical.net/health/How-is-RRMS-Different-from-PPMS-and-SPMS.aspx. (accessed January 21, 2021). Mandal, Ananya. 2018. . News-Medical, viewed 21 January 2021, https://www.news-medical.net/health/How-is-RRMS-Different-from-PPMS-and-SPMS.aspx. Nerve insulation renewed to create long-term learning Discovery could have important implications for brain infections, neurodegenerative diseases Study sheds light on myelin's role in",-0.159821942448616
5eb2be07-cabc-407c-a9de-6ab7f7488611,"Medically reviewed by — — Understanding the typical progression of multiple sclerosis (MS) and learning what to expect can help you gain a sense of control and make better decisions. MS occurs when the body’s immune system abnormally targets the central nervous system (CNS), though it’s not considered to be an autoimmune disorder. The attack on the CNS damages the myelin and the nerve fibers that the myelin protects. The damage disrupts or distorts the nerve impulses being sent down the spinal cord. People with MS generally follow one of four disease courses that vary in severity. The first stage to consider occurs before your doctor has made a diagnosis of MS. In this initial stage, you may have symptoms that you’re concerned about. Genetic and environmental factors are thought to play a role in who gets MS. Perhaps MS runs in your family, and you’re worried about your likelihood of developing the disease. Maybe you’ve previously experienced symptoms that your doctor has told you might be indicative of MS. At this stage, your doctor can determine whether you’re at high risk for developing the condition based on your medical history and a physical exam. However, there is no definitive test to confirm the presence of MS and many of the symptoms also occur with other conditions, so the disease can be tough to diagnose. The next step on the continuum is receiving a diagnosis of MS. Your doctor will diagnose you with MS if there is clear evidence that, at two different points in time, you have had separate episodes of disease activity in your CNS. Often it can take time to make this diagnosis because other conditions must first be ruled out. These include CNS infections, CNS inflammatory disorders, and genetic disorders. In the new diagnosis stage, you will likely discuss treatment options with your doctor and learn new ways to manage everyday activities with your condition. There are different types and stages of MS. Learn more below about the different types. This is the first episode of symptoms caused by inflammation and damage to the myelin covering on nerves in the brain or spinal cord. Technically, CIS doesn’t meet the criteria for a diagnosis of MS as it’s an isolated incident with only one area of demyelination responsible for symptoms. If an MRI shows another episode in the past, a diagnosis of MS can be made. The type of MS generally follows a predictable pattern with periods in which symptoms worsen and then improve. Eventually it may progress to . According to the , around 85 percent of people with MS are initially diagnosed with relapsing-remitting MS. People with RRMS have flare-ups (relapses) of MS. Between the relapses, they have periods of remission. Over a few decades, the course of the disease is likely to change and become more complex. Relapsing-remitting MS can progress into a more aggressive form of the disease. The reports that, if left untreated, half of those with the relapsing-remitting form of the condition develop secondary-progressive MS within a decade of the first diagnosis. In",-0.2441569715738296
gpt2-large_57_multimedqa_3,"The following is the general information on MS stages for women in the United States: MS stage 1 - Mild disability (no symptoms) MS stage 2 - Mild or moderate disability (symptoms are present but do not require treatment) MS stage 3 - Severe disability (severe pain, swelling, and stiffness of muscles/joints) MS stage 4 - Very severe disability (bleeding from joints, loss of muscle strength and range of motion, loss of vision and hearing) If you want to find out more about this disease, we recommend that you seek expert advice from your doctor. Our website also contains information on treating MS. Do I need an MRI? You may be asked to have a CT scan (computed tomography) performed at some time during your treatment program. These scans can reveal signs and symptoms of MS as well as help determine if there are any underlying disorders causing the condition. It's generally recommended that if your doctor does order a scan that it will take place within two weeks after beginning treatment (after six months you should expect to see improvement). However, many people have good results with regular checkups for several years without needing an MRI. When would I start treatment with Cymbalta? If your primary care physician prescribes Cymbalta, he or she will prescribe starting you off slowly with low doses each week until you notice significant benefit. Your doctor could also suggest switching to higher dose Cymbalta when you begin experiencing serious side effects such as joint pain. After you reach 20 mg, most patients experience a gradual increase in dosage over several months. For example, once your baseline dose of 40 mg has been reached, 50 mg will gradually become a daily dose. At 10 mg, 150 mg becomes 200 mg. If you are taking Cymbalta in combination with other medications, ask your doctor about dosing adjustments. As mentioned above, there is no specific minimum dose of Cymbalta you must follow. If you feel discomfort using Cymbalta, don't use it. The amount you should consume depends on how much you're already taking and how far along you've progressed. Don't miss doses! How effective is Cymbalta? How effective is Cymbalta? You'll get better faster if you start treating MS early so you can avoid suffering the complications associated with progressing to MS. To learn more, click here. Most of the studies on Cymbalta indicate that people who",-0.8355854749679565
a925962c-b7f3-474b-b5fb-6c8c1822b6d1,"Multiple sclerosis is an in which activated invade the and cause , , and tissue damage. The underlying cause is currently unknown. Current research in , , , and , together with , provide support for the notion that MS is not a single disease but rather a spectrum. There are three : , characterized by periods of neurological worsening following by remissions; , in which there is gradual progression of neurological dysfunction with fewer or no relapses; and , in which neurological deterioration is observed from onset. is a convergence of pathology with physiology. Pathology is the medical discipline that describes conditions typically observed during a disease state; whereas physiology is the biological discipline that describes processes or mechanisms operating within an organism. Referring to MS, the physiology refers to the different processes that lead to the development of the lesions and the pathology refers to the condition associated with the lesions. Multiple sclerosis can be pathologically defined as the presence of distributed (or ) in the disseminated in time (DIT) and space (DIS). The gold standard for MS diagnosis is pathological correlation, though given its limited availability, other diagnosis methods are normally used. The scleroses that define the disease are the remainders of previous demyelinating lesions in the CNS white matter of a patient () showing special characteristics, such as confluent instead of perivenous demyelination. There are two phases for how an unknown underlying condition may cause damage in MS: An unknown soluble factor (produced by CD8+ T-cells or CD20+ B-cells), creates a toxic environment that activates microglia. with hidden damage appear in the brain and spine (). Some clusters of activated , axonal transection and myelin degeneration are present. appear and immune cells infiltrate, causing . and axon destruction. Multiple sclerosis differs from other in its confluent cortical lesions. These types of lesions are the most specific finding for MS, being exclusively present in MS patients, though currently they can only be detected at autopsy. Most MS findings take place inside the white matter, and lesions appear mainly in a periventricular distribution (clustered around the ventricles of the brain). Apart from demyelination, the and deep (GM) nuclei can be affected, together with diffuse injury of the NAWM. GM atrophy is independent of classical MS lesions and is associated with physical disability, fatigue, and cognitive impairment in MS At least five characteristics are present in CNS tissues of MS patients: beyond classical white matter lesions, production with , an environment fostering immune cell persistence, and a disruption of the outside of active lesions. The that give the name to the condition are produced by healing old lesions. MS is active even during remission periods. -like aggregates in the are formed only in secondary progressive MS. and correlate with the degree of subpial cortical demyelination and brain atrophy, suggesting that they might contribute to cortical pathology in SPMS These follicles are composed mainly of infected B-cells. Four different damage patterns have been identified in patient's brain tissues. The original report suggests that there may be several types of MS with different",-1.0965871810913086
